{
  "$schema": "https://json-schema.org/draft/2020-12/schema",
  "$id": "order.schema.json",
  "title": "Order policy: demand and rhythm, not production",
  "type": "object",
  "required": [
    "schema_version",
    "kind",
    "id",
    "version",
    "mode",
    "patience_default_game_ms"
  ],
  "properties": {
    "schema_version": {
      "const": 1
    },
    "kind": {
      "const": "order_policy"
    },
    "id": {
      "$ref": "common.schema.json#/$defs/content_id"
    },
    "version": {
      "$ref": "common.schema.json#/$defs/version"
    },
    "name": {
      "$ref": "common.schema.json#/$defs/display_name"
    },
    "mode": {
      "enum": [
        "legacy_finite",
        "fixed_interval_seeded",
        "fixed_table"
      ]
    },
    "first_spawn_game_ms": {
      "$ref": "common.schema.json#/$defs/game_ms"
    },
    "interval_game_ms": {
      "$ref": "common.schema.json#/$defs/positive_game_ms"
    },
    "stop_spawn_game_ms": {
      "$ref": "common.schema.json#/$defs/positive_game_ms",
      "description": "Optional; defaults to the round limit (orders keep arriving until closing)."
    },
    "patience_default_game_ms": {
      "$ref": "common.schema.json#/$defs/positive_game_ms"
    },
    "patience_by_recipe": {
      "type": "object",
      "propertyNames": {
        "$ref": "common.schema.json#/$defs/ident"
      },
      "additionalProperties": {
        "$ref": "common.schema.json#/$defs/positive_game_ms"
      }
    },
    "sequence": {
      "description": "legacy_finite: recipe bag in listed order; optionally shuffled once with the order seed.",
      "type": "array",
      "minItems": 1,
      "items": {
        "type": "object",
        "required": [
          "recipe_ref",
          "count"
        ],
        "properties": {
          "recipe_ref": {
            "$ref": "common.schema.json#/$defs/ident"
          },
          "count": {
            "type": "integer",
            "minimum": 1
          }
        },
        "additionalProperties": false
      }
    },
    "shuffle": {
      "type": "boolean"
    },
    "menu": {
      "description": "fixed_interval_seeded: positive weights, sampled in stable recipe_ref order.",
      "type": "array",
      "minItems": 1,
      "items": {
        "type": "object",
        "required": [
          "recipe_ref",
          "weight"
        ],
        "properties": {
          "recipe_ref": {
            "$ref": "common.schema.json#/$defs/ident"
          },
          "weight": {
            "$ref": "common.schema.json#/$defs/positive_number"
          }
        },
        "additionalProperties": false
      }
    },
    "arrivals": {
      "description": "fixed_table: explicit arrivals.",
      "type": "array",
      "minItems": 1,
      "items": {
        "type": "object",
        "required": [
          "recipe_ref",
          "arrival_game_ms"
        ],
        "properties": {
          "recipe_ref": {
            "$ref": "common.schema.json#/$defs/ident"
          },
          "arrival_game_ms": {
            "$ref": "common.schema.json#/$defs/game_ms"
          },
          "patience_game_ms": {
            "$ref": "common.schema.json#/$defs/positive_game_ms"
          }
        },
        "additionalProperties": false
      }
    },
    "extensions": {
      "$ref": "common.schema.json#/$defs/extensions"
    }
  },
  "additionalProperties": false
}
