{
  "schema_version": 1,
  "kind": "order_policy",
  "id": "pilot-draft-mixed",
  "version": 1,
  "name": "试点草案订单（未批准）",
  "mode": "fixed_interval_seeded",
  "first_spawn_game_ms": 0,
  "interval_game_ms": 25000,
  "stop_spawn_game_ms": 175000,
  "menu": [
    {
      "recipe_ref": "steak",
      "weight": 3
    },
    {
      "recipe_ref": "burger",
      "weight": 4
    }
  ],
  "patience_default_game_ms": 100000,
  "patience_by_recipe": {
    "steak": 100000,
    "burger": 120000
  },
  "extensions": {
    "chefjeff.status": "draft values from the order-pacing proposal; not approved for play"
  }
}
